{"$schema":"https://json-schema.org/draft/2020-12/schema","additionalProperties":false,"properties":{"N":{"enum":[8,32]},"checkpoints":{"items":{"additionalProperties":false,"properties":{"checkpoint_id":{"enum":[1,2,3]},"delta":{"items":{"oneOf":[{"additionalProperties":false,"properties":{"action_id":{"pattern":"^[0-9a-f]{24}$","type":"string"},"message_id":{"pattern":"^[0-9a-f]{24}$","type":"string"},"op":{"const":"INITIALIZE"},"order":{"maximum":37,"minimum":1,"type":"integer"},"reliability":{"const":1.0},"root_id":{"pattern":"^[0-9a-f]{24}$","type":"string"},"support":{"enum":[0.001,0.2,0.4,0.6,0.8],"type":"number"},"version":{"enum":[1,2]}},"required":["action_id","op","order","message_id","version","root_id","support","reliability"],"type":"object"},{"additionalProperties":false,"properties":{"action_id":{"pattern":"^[0-9a-f]{24}$","type":"string"},"canonical_root":{"pattern":"^[0-9a-f]{24}$","type":"string"},"op":{"enum":["RETIRE","SUPERSEDE","EQUIVALENCE","REPLAY"]},"order":{"maximum":37,"minimum":1,"type":"integer"},"replacement_root":{"pattern":"^[0-9a-f]{24}$","type":"string"},"roots":{"items":{"pattern":"^[0-9a-f]{24}$","type":"string"},"maxItems":4,"type":"array","uniqueItems":true}},"required":["action_id","op","order","roots"],"type":"object"}]},"maxItems":3,"minItems":1,"type":"array"}},"required":["checkpoint_id","delta"],"type":"object"},"maxItems":3,"minItems":3,"type":"array"},"initial_actions":{"items":{"additionalProperties":false,"properties":{"action_id":{"pattern":"^[0-9a-f]{24}$","type":"string"},"message_id":{"pattern":"^[0-9a-f]{24}$","type":"string"},"op":{"const":"INITIALIZE"},"order":{"maximum":37,"minimum":1,"type":"integer"},"reliability":{"const":1.0},"root_id":{"pattern":"^[0-9a-f]{24}$","type":"string"},"support":{"enum":[0.001,0.2,0.4,0.6,0.8],"type":"number"},"version":{"enum":[1,2]}},"required":["action_id","op","order","message_id","version","root_id","support","reliability"],"type":"object"},"maxItems":32,"minItems":8,"type":"array"},"method_cap":{"additionalProperties":false,"properties":{"max_active_contributions":{"const":128},"max_contribution_budget":{"const":128}},"required":["max_active_contributions","max_contribution_budget"],"type":"object"},"schema_version":{"const":"pcg-stream-input.v1"},"sequence":{"enum":["S1","S2","S3","S4"]}},"required":["schema_version","sequence","N","initial_actions","checkpoints","method_cap"],"type":"object"}
