{"N":8,"checkpoints":[{"checkpoint_id":1,"delta":[{"action_id":"4950253488f421377bbff21a","op":"RETIRE","order":9,"roots":["b02124c10ae59daf87bf1d21"]}]},{"checkpoint_id":2,"delta":[{"action_id":"079096336f13efea5f8c8b7c","message_id":"4f501dda469b53a95d2b6e6c","op":"INITIALIZE","order":10,"reliability":1.0,"root_id":"b02124c10ae59daf87bf1d21","support":0.6,"version":1}]},{"checkpoint_id":3,"delta":[{"action_id":"fda98a4c0fd81ab878385c3c","message_id":"81a810bbc26bd3acdeb916bc","op":"INITIALIZE","order":11,"reliability":1.0,"root_id":"ed001fd07df08ab533ec7257","support":0.8,"version":1}]}],"initial_actions":[{"action_id":"6b1b7f7de1f730417b8d519c","message_id":"4f501dda469b53a95d2b6e6c","op":"INITIALIZE","order":1,"reliability":1.0,"root_id":"b02124c10ae59daf87bf1d21","support":0.6,"version":1},{"action_id":"3147947ee7e7701eb014fe62","message_id":"337d997b200a98c20555bb08","op":"INITIALIZE","order":2,"reliability":1.0,"root_id":"9d0ecfc8687e5b1897f3c7d1","support":0.001,"version":1},{"action_id":"ca22fcbf2b1591bcf1220be4","message_id":"3173fa13d514e9c9c7157b55","op":"INITIALIZE","order":3,"reliability":1.0,"root_id":"99735e92b897a35c301b57c4","support":0.001,"version":1},{"action_id":"19984efe72396442f012bf7e","message_id":"98c8e0f5ae66efa0ca91152e","op":"INITIALIZE","order":4,"reliability":1.0,"root_id":"a143e0b947f205f4a768cfd5","support":0.001,"version":1},{"action_id":"df0ba233663555ab762923bc","message_id":"8f2051835b18cab702952d2d","op":"INITIALIZE","order":5,"reliability":1.0,"root_id":"b87290480229f234ef96c2dd","support":0.001,"version":1},{"action_id":"462bddd734597896d1a77ea6","message_id":"c161c5c4357db6d756b88a30","op":"INITIALIZE","order":6,"reliability":1.0,"root_id":"c14ad3c881c7d49b5992a5cd","support":0.001,"version":1},{"action_id":"e15558e76b748d6c445b4495","message_id":"b30b905710a7ba9cc6497d1a","op":"INITIALIZE","order":7,"reliability":1.0,"root_id":"8fe7b73f464b01597857eb5f","support":0.001,"version":1},{"action_id":"00cc78350372dd19356c657b","message_id":"17793b9e543c3edf27c30d7e","op":"INITIALIZE","order":8,"reliability":1.0,"root_id":"bb380af7c13c0dea6164e237","support":0.001,"version":1}],"method_cap":{"max_active_contributions":128,"max_contribution_budget":128},"schema_version":"pcg-stream-input.v1","sequence":"S2"}
